{
  "schema_version": 1,
  "id": "sri-lankan-lamb-curry-for-kothu",
  "title": "Sri Lankan Lamb Curry for Kothu",
  "description": "Overnight-marinated lamb, browned hard then simmered in a roasted-spice, lemongrass and pandan gravy, finished with coconut milk.",
  "yield": { "base_servings": 2, "label": "portions of kothu" },
  "advance_prep": ["Marinate the lamb overnight"],
  "tags": ["sri lankan", "lamb", "curry", "kothu"],
  "ingredients": [
    { "id": "0001", "group": "Marinade", "name": "lamb neck or shoulder fillets", "short_name": "lamb", "prep": "diced into 4cm (1½in) pieces", "amount": 500, "unit": "g" },
    { "id": "0002", "group": "Marinade", "name": "minced ginger", "short_name": "ginger", "amount": 1, "unit": "tsp" },
    { "id": "0003", "group": "Marinade", "name": "minced garlic", "short_name": "garlic", "amount": 1, "unit": "tsp" },
    { "id": "0004", "group": "Marinade", "name": "ground turmeric", "short_name": "turmeric", "amount": 0.5, "unit": "tsp" },
    { "id": "0005", "group": "Marinade", "name": "curry powder", "short_name": "curry powder", "amount": 1, "unit": "tsp" },
    { "id": "0006", "group": "Marinade", "name": "salt", "short_name": "salt", "amount": 0.25, "unit": "tsp" },
    { "id": "0007", "group": "Curry", "name": "coconut oil, for browning", "short_name": "coconut oil", "amount": 2, "unit": "tbsp" },
    { "id": "0008", "group": "Curry", "name": "coconut oil, for the curry base", "short_name": "coconut oil", "amount": 1, "unit": "tbsp" },
    { "id": "0009", "group": "Curry", "name": "cinnamon stick, 9cm (3½in)", "short_name": "cinnamon stick", "amount": 1, "unit": null },
    { "id": "0010", "group": "Curry", "name": "green cardamom pods", "short_name": "cardamom pods", "amount": 4, "unit": null },
    { "id": "0011", "group": "Curry", "name": "cloves", "short_name": "cloves", "amount": 4, "unit": null },
    { "id": "0012", "group": "Curry", "name": "onion (about 1 medium)", "short_name": "onion", "prep": "sliced", "amount": 150, "unit": "g" },
    { "id": "0013", "group": "Curry", "name": "salt, for the onion", "short_name": "salt", "amount": 1, "unit": "pinch" },
    { "id": "0014", "group": "Curry", "name": "minced ginger", "short_name": "ginger", "amount": 1, "unit": "tbsp" },
    { "id": "0015", "group": "Curry", "name": "minced garlic", "short_name": "garlic", "amount": 1, "unit": "tbsp" },
    { "id": "0016", "group": "Curry", "name": "Roasted Curry Powder", "short_name": "roasted curry powder", "amount": 1.5, "unit": "tbsp" },
    { "id": "0017", "group": "Curry", "name": "ground turmeric", "short_name": "turmeric", "amount": 0.5, "unit": "tsp" },
    { "id": "0018", "group": "Curry", "name": "chilli powder", "short_name": "chilli powder", "amount": 2, "unit": "tsp" },
    { "id": "0019", "group": "Curry", "name": "lemongrass stalk", "short_name": "lemongrass", "amount": 1, "unit": null },
    { "id": "0020", "group": "Curry", "name": "pandan leaf, 5cm (2in) piece", "short_name": "pandan leaf", "amount": 1, "unit": null },
    { "id": "0021", "group": "Curry", "name": "curry leaves", "short_name": "curry leaves", "amount": 10, "amount_max": 12, "unit": null },
    { "id": "0022", "group": "Curry", "name": "large ripe tomato", "short_name": "tomato", "prep": "sliced", "substitutes": "or 3 tbsp canned chopped tomatoes", "amount": 1, "unit": null },
    { "id": "0023", "group": "Curry", "name": "stock or water", "short_name": "stock", "amount": 250, "unit": "ml" },
    { "id": "0024", "group": "Curry", "name": "coconut milk", "short_name": "coconut milk", "amount": 100, "unit": "ml" },
    { "id": "0025", "group": "Curry", "name": "green chillies", "short_name": "green chillies", "prep": "halved widthways", "optional": true, "amount": 2, "unit": null },
    { "id": "0026", "group": "Curry", "name": "salt, to finish", "short_name": "salt", "amount": 0.5, "unit": "tsp" }
  ],
  "steps": [
    { "id": "s1", "title": "Marinate overnight", "content": "Mix {0001} with {0002}, {0003}, {0004}, {0005} and {0006} until every piece is coated. Cover and refrigerate overnight." },
    { "id": "s2", "title": "Brown the lamb", "heat": "medium_high", "timer_seconds": 300, "timer_max_seconds": 420, "content": "Heat {0007} in a large heavy-based pan. Add the {0001:name} and fry until browned on all sides. Don't stir too much — you want it to brown, not release its juices and stew." },
    { "id": "s3", "title": "Set the lamb aside", "content": "Lift the {0001:name} onto a plate with a slotted spoon." },
    { "id": "s4", "title": "Bloom whole spices", "heat": "medium_high", "timer_seconds": 60, "content": "Add {0008} to the pan, then {0009}, {0010} and {0011}. Fry until fragrant." },
    { "id": "s5", "title": "Soften the onion", "timer_seconds": 360, "timer_max_seconds": 480, "content": "Add {0012} and {0013}. Sauté until soft and translucent." },
    { "id": "s6", "title": "Fry ginger and garlic", "timer_seconds": 120, "timer_max_seconds": 180, "content": "Add {0014} and {0015} and fry until the raw smell is gone." },
    { "id": "s7", "title": "Add spices and aromatics", "timer_seconds": 60, "content": "Add {0016}, {0017}, {0018}, {0019}, {0020} and {0021}. Fry for 1 minute, adding a splash of stock or water if the spices stick." },
    { "id": "s8", "title": "Cook down the tomato", "heat": "medium", "timer_seconds": 300, "content": "Add {0022}. Cook, stirring often, until thick and pulpy." },
    { "id": "s9", "title": "Return the lamb", "timer_seconds": 120, "content": "Return the {0001:name} to the pan and stir to coat in the spiced tomato paste." },
    { "id": "s10", "title": "Simmer until tender", "heat": "medium_low", "timer_seconds": 900, "timer_max_seconds": 1200, "content": "Stir in {0023}. Cover and simmer until the lamb is tender." },
    { "id": "s11", "title": "Add coconut milk", "heat": "low", "timer_seconds": 240, "timer_max_seconds": 300, "content": "Stir in {0024} and keep at a gentle simmer." },
    { "id": "s12", "title": "Add green chillies", "timer_seconds": 60, "content": "If using, add {0025} and cook for 1 final minute." },
    { "id": "s13", "title": "Season and cool", "content": "Season with {0026}, taste and adjust. Let it cool until you're ready to make your kothu." }
  ],
  "notes": "Remove the cinnamon stick, lemongrass and pandan before chopping into kothu.",
  "cook_notes": [
    "Try adding cumin seeds next time.",
    "Fried shallots would make a good garnish."
  ],
  "related_recipes": ["roasted-curry-powder", "kothu"],
  "source": { "type": "book", "original_filename": "lamb-curry-for-kothu.txt" },
  "source_text_sha256": "8b936330837e0386db59298a042fe1f909353d5b88a708b8ec856ddc74036c2a",
  "review_flags": [
    { "path": "ingredients[8].amount", "message": "Source says \"2 9cm (3½in) cinnamon stick\" — assumed 1 stick. Confirm whether it should be 2." }
  ],
  "status": "needs_review",
  "created_at": "2026-10-15T00:00:00Z",
  "updated_at": "2026-10-15T00:00:00Z"
}
